movie_title,review
캐스트 어웨이,"조난 전의 삶, 무인도에서의 삶, 구조 후의 삶. 인생이라는 망망대해 속 끝없이 표류하며 수많은 선택과 획득, 상실의 나날이지만 그럼에도 불구하고 희망이 있어 오늘도 살아간다."
캐스트 어웨이,FedEx 광고같은 설정에 요상한 주인공의 상황들.
캐스트 어웨이,윌슨과 함께 버틴 긴세월
캐스트 어웨이,"해가 뜨면 나에게 주어진 일을 하고, 파도가 또 다른 곳으로 인도하며 살아간다."
캐스트 어웨이,탈출 후에도 막막하지만 계속 살아간다
캐스트 어웨이,배구공에 얼굴을 그려놓고는 ‘윌슨’을 목놓아 부르던 주인공의 모습이 인상적이었던 어릴 적의 그 영화는 어른이 되어 삶의 여정 속에서 길을 잃고 헤매는 이들에게 위로를 전해준다.
캐스트 어웨이,"무인도는 종착지가 아닌 경유지였음을. 새로운 항해는, 이제부터 시작이다. (+ 윌슨은 아카데미 조연상 하나라도 줘야 하지 않을지.)"
캐스트 어웨이,정해진 길은 없다. 길은 내가 선택하는 것이다
캐스트 어웨이,뜬금없는 배구공 판매율 증가에 기여했던 영화... ㅋㅋ
캐스트 어웨이,"그래도, 계속 숨을 쉬어야지."
캐스트 어웨이,제한된 공간 속 외로움의 극치를 잘 표현했다
캐스트 어웨이,윌슨…
캐스트 어웨이,나라도 저렇게 될 것 같다. 명작이다.
캐스트 어웨이,고독함과 외로움을 이겨내지 못한다면 결코 홀로 살아갈 수 없음을 알려줍니다.
캐스트 어웨이,목적을 잃었다면 그곳이 표류지이다
캐스트 어웨이,윌스뉴ㅠㅠ
캐스트 어웨이,윌슨 너라면 열친구 안 부럽다
캐스트 어웨이,내 인생작
캐스트 어웨이,"톰 행크스, 톰 행크스"
캐스트 어웨이,이별하는 법을 배웠다
캐스트 어웨이,엉엉
캐스트 어웨이,여주인공 헬렌헌트의 비오는 장면에서의 애틋한 감정을 이해 하려고 노력해 봅니다.
캐스트 어웨이,명작.
캐스트 어웨이,톰 행크스가 고생할수록 재밌어지는 영화
캐스트 어웨이,포기하지 말자
캐스트 어웨이,정말 웃기고 또 엄청 슬픈 영화 후반부에 윌슨이랑 헤어지는 장면이 너무 슬펐다 배구공이랑 헤어지는게 너무 슬프다
캐스트 어웨이,"어느 순간에도 희망은 있고, 삶은 계속 된다."
캐스트 어웨이,휴머니즘 재난 서바이벌 영화. 너무 어릴때 봐서인지 나도 혹시 무인도에 불시착하거나 표류하다 떠밀려가면 이 영화에서 본 거 잘 기억했다가 활용해야지 했던 기억이 난다^^
캐스트 어웨이,비행기 위(사회)와 망망대해(야생)에서 표류하던 그에게 단 하나의 길이 명확해지는 순간.
캐스트 어웨이,극한 환경에 처한 인간이 전달하는 감정과 의지
캐스트 어웨이,잘가...윌슨...😭🏐
캐스트 어웨이,인생 최고의 명작입니다. 힘들때마다 꺼내 보는 작품입니다.
캐스트 어웨이,영화 02
캐스트 어웨이,공 하나로 이런 감정을 줄 수 있네?
캐스트 어웨이,한 남자의 표류가 수많은 사람으로 하여금 삶의 가치를 돌아보게 한다.
캐스트 어웨이,"톰행크스와 윌슨이 주인공이다.인간이 얼마나 무섭게 적응의 동물인지를 보았고, 사람과사람사이의 유대라는게 또 얼마나 중요한지 깨닫기도하다."
캐스트 어웨이,그 상실감에 대해서.....
캐스트 어웨이,어떤 소포가 올 지 알 수가 없네.
캐스트 어웨이,솔직히 로버트 저메키스 감독하면 보통 포레스트 검프를 떠올리겠지만 나는 캐스트 어웨이가 가장 명작이라 생각한다
캐스트 어웨이,계속 숨을 쉬어야 한다.
캐스트 어웨이,윌슨이 떠내려갈때 나도 울었다
캐스트 어웨이,삶을 목적을 가지고 설령 잃어도 계속 살아가야한다 자연과 인간이 그리워지는 2시간 여행
캐스트 어웨이,순간의 결정보다는 신중하게 고민하고 치열하게 살아갈 것.
캐스트 어웨이,윌슨!
캐스트 어웨이,너랑 첫 영화
캐스트 어웨이,윌슨이 여러명이였다면 주인공은 어떻게 되었을까?
캐스트 어웨이,어떤 포인트에서 감동이 넘쳐야 하나?
