titles,reviews
천박사 퇴마 연구소: 설경의 비밀," 애써 트렌디한 척하는 얕은 올드함. <천박사 퇴마 연구소>선택과 집중이 확실한 퇴마 판타지
웹툰 실사화의 딜레마

웹툰 원작 작품을 영화나 드라마로 옮길 때 항상 같은 딜레마가 있다. 바로 '톤'이다. 웹툰은 과장되거나 비현실적인 톤을 지니는 경우가 많다. 자연히 원작을 지나치게 충실하면 작위적이거나 오그라들기 십상이다. 반대로 그렇다고 원작 색채를 과하게 빼 버리면 팬덤의 불만을 산다. 웹툰 원작 작품이 홍수처럼 쏟아지는 와중에도 눈에 띄는 반응을 이끌어내는 경우가 많지 않은 이유다.

<기생충>과 <헤어질 결심> 조감독 출신인 김성식 감독의 <천박사 퇴마 연구소: 설경의 비밀>(이하 <천박사>)는 위 딜레마를 정면으로 돌파한다. 후렛샤 작가의 '빙의'를 영상화한 이 작품은 철저한 선택과 집중의 미덕을 보여준다. 웹툰 느낌을 살린다는 목적을 위해 장르, 캐릭터, 볼거리에만 초점을 맞추고 질주한다. 뛰어난 작품성이나 완성도를 보여주겠다는 야심은 없다. 그리고 그 계획은 결과물에 고스란히 반영됐다.

(...)

결국 <천박사>는 캐릭터와 CG, 설정이 조금 독특할 뿐 어디서나 볼 수 있는 무난한 명절 영화에 그친다. 실패라고 말할 수는 없다. 의도대로 시작부터 끝까지 경쾌한 톤의 코믹 액션 오컬트 영화를 보여주는 데는 성공했다. 계획대로 결과물이 정직하게 뽑힌 듯 보여서 비판하기도 애매하다. 단지 아쉬울 뿐이다. 한국 상업 영화 중 나름대로 신선한 시도가 엿보이는 장르 영화이기에 아쉬움은 더욱 크다.


Acceptable 무난함
화려하나 어색한 CG만큼 오묘한 끝맛
리뷰 전문 보기 분위기를 잘 잡았고 배우들의 연기도 좋았으나 소재가 시시하게 표현됐다. 신비아파트 실사판 그냥 집에서 계속 무빙이나 볼걸 그랬네.. 화려한 영상과 섬세한 연기 특수효과 대사 특별출연 모든 것이 잘 어우러져 재밌게 봄. 선녀도사가 깜짝 놀라게 하는데 연기력으로 감초역할을 톡톡히 함.온가족이 함께봐도 좋을 영화 매력적인 세계관인 마냥 내내 세뇌당하는 것 같았다. 🗡 판타지 영화 1편이 마땅히 해야할 세계관의 설득은 이루어지지 않은 채 꾸역꾸역 세뇌만 당하는 기분 #전우치 를 꿈꾸었으나 (장르 영화의 의무는 장르가 명확해야 한다는 것) 좋게 말하면 참 요즘 시대스러운 오락영화이고, 나쁘게 말하면 쉬운길만 선택하는 얍삽한 영화이다.
좋게 말하면 참 요즘 시대스러운 오락영화이고, 나쁘게 말하면 쉬운길만 선택하는 얍삽한 영화이다. 적당한 스토리와 전개에 강동원을 위시한 배우들의 힘을 모으고 현란하고 화려한 CG로 힘을 잔뜩 준 영화는 생각없이 볼 수 있는 킬링타임 무비로는 손색이 없다. 이걸 반대로 말하자면, 영화 자체의 매력이 한 줌이라는 점. 캐릭터의 힘과 매력이나 과잉된 특수효과에 코미디와 호러의 조합은 무뎌지고 그저 결말이 예상가능한 예능프로그램 한 편 감상하고 나온 것 같은 가벼운 뒷맛만 남기고 간다. 따지자면 외계인 1부가 차라리 더... “범천아 그냥 내 눈을 가져가라”
가족이랑 다같이 볼 수 있는게 뭘까 싶어서 보러간 영화인데, 내가 다 미안해 죽을뻔 했다.

도대체 뭐냐?
이 옛날 올드한 표현의 CG는...

설경에 칼 꽂고 하는 장면에서 미쳐돌아버리는 줄 알았다.

강동원 외모점수 5점 만점 10점
영화 재미도 5점 만점 -8점
그래서 5점 만점 2점 이것저것 화려하게 펼쳐놨는데 야무지게 믹스매치가 잘 안된느낌. 딱히 끌리는 구석이 없어서 아쉽다. 킬링타임용 오락영화인데 신나지 않아서 러닝타임이 길게 느껴짐 마법천자문과 전우치를 유치하게 오싹하게
어릴적 나를 즐겁게 해주었던 마법천자문과 강동원의 대표 영화 전우치를 합친 듯한 영화로 유치하지만 다소 오싹하게 만든 느낌의 영화. 오락적인 부분에서는 명절에 최적이구나 싶은데 아동용인가 싶을 정도로 유치하고 CG가 좀 애매하다. 가성비 느낌이 상당히 강했으며 동시에 최선을 다했다 싶은 느낌이랄까. 메이플스토리 게임 6차 전직 스킬 화면을 보는것 같은 임펙트에 조금 당황하긴 했지만 유치 찬란함 속 묘하게 빠져드는 매력이 있어서 오묘하게 계속 본듯 싶다. 서사나 개그는 정말 별로였는데 대적하는 부분은 좋았다고 정리를 해본다. 다만 그게 딱 영화만의 장점이라고 하기엔 가벼운 오락성 그거 말곤 좀 모르겠는 영화로 명절 승리자가 될것 같다라는 느낌은 들지만 시리즈의 가능성은 정말 모르겠다. 그냥 전체적으로 나도 모르겠는 그런 영화. 내 몸이 거부하는건지, 내 눈이 거부한건지, 부정을 하는건지, 아니면 반대로 받아들이려고 노력을 한건지.
리뷰 전문 보기 전우치 좀 만들어 주세요. 막 잘만든 영화 같지는 않지만 묘한 매력에 이끌리는 영화이다. 캐릭터들이 가진 매력일까? 단지 너무 영화의 설정들을 가볍게 표현한 것이 아쉽다. 한줄평 (영상 포함) 믿고보는 재미작. 선정성과 폭력성에 의존하지 않은 재미를 주는 이런 영화 찐으로 고팠다. 장르의 매력을 겸한 현대판 퇴마사 자국에서 이러한, 오락과 액션 등에 초점을 둔 채 시리즈로서의 잠재력을 보이는 영화가 나오면 어느 정도 반기는 마음이 있다.
자국에서 이러한, 오락과 액션 등에 초점을 둔 채 시리즈로서의 잠재력을 보이는 영화가 나오면 어느 정도 반기는 마음이 있다. 영화 <천박사 퇴마 연구소: 설경의 비밀>(2023)은 (짧은 상영시간이 말해주듯) 큰 욕심도 없어 보이는 한편 그리 특출난 만듦새를 뽐내지는 못하지만 제법 명절이라는 시즌에 어울릴 만한 작품이다. 웹툰 등의 IP 기반 콘텐츠가 넘쳐나는 요즘이지만, 장르와는 별개로 나름대로 고유한 소재를 활용하려 한 점도 이 영화가 그렇게 나쁘지는 않다고 생각하게 해준다. (2023.09.30.) 영화 보기 전에 예고를 봤을 때 신비아파트 같다고 생각했는데 다 보고 나서도 여전히 신비아파트같다. 23.09.28 메가박스 부산대 화려하지만 실속은 없는 퇴마 탐정의 등장 남들이 재밌다고 해서 보면 실망할 거 같고, 남들이 별로라고 해서 보면 재밌게 볼것같은. 약간 <외계+인> 의 평가와 비슷할 것 같음 ㅋ 오락영화로는 괜찮은듯. 시리즈 기대 음산한 분위기의 퇴마가 아닌 코믹하고 빠른 전개의 퇴마영화. 초반이 살짝 늘어지는 느낌이 들 수 있으나 전체적으로 호흡은 괜찮음. 씬스틸러 찾아보기 추천 처음부터 끝까지 무난하고 경쾌한, 모범생 같은 속편을 만들고 싶은 퇴마 코믹 액션. 각자 역할은 있으나 캐릭터 간의 관계 묘사는 없고, 귀신은 보이나 장르는 희미하다. 지수의 등장씬과 강동원 얼굴만 남는 영화 생각없이 시간보내기. 한국판 압축된 다만 엉성한 해리포터ᆢ 맞지 않는 조합을 애써 끼워 만든 결과물
사실 원작인 웹툰을 먼저 접했고, 꽤나 진중하고 무거운 분위기가 될 것으로 기대했다. 하지만 명절을 노린 가벼운 영화로 공개되었고, 여기에서 1차 아쉬움을 남겼다.

영화의 뼈대인 퇴마, 그리고 영매는 그대로 가져왔다. 하지만 악귀의 능력에 과하게 그래픽을 입혀 스릴러가 아닌 액션영화로 둔갑시켰다. 이를 긴장감 있게 녹여냈으면 모르겠지만, 어른보다 애들을 목표로 한 듯 유치한 방식으로 흘러가 실망이 컸다.

작품이 [전우치]처럼 잘 만들어졌다면 모를까, 어설픈 조합에 강동원의 능청스런 연기가 아쉬울 뿐이었다. 6화짜리 드라마로 나와서 캐릭터에 대한 설명이 좀 더 있었다면 훨씬 평이 좋지 않았을까 한다. 이런 장르 영화치곤 제법 잘 만든 것 같은데 포스터가 너무 개그물 같이 나옴 ㅠ 맞물리지 않는 서사와 연기로 엉성하게 짠 오컬트 어드벤처(1.5)"
추락의 해부," 어떠한 갈등이든 사건이든 깊게 파고들면 들수록 결국 남는건 상처뿐이다. 가족의 붕괴, 사건을 해부하다. 진실은 핵심이 아니다. 추락한 순간 이미 산산히 부서진 조각들을 이어붙이다 무엇이 부서졌는지를 알아가는 심리드라마 법정극.
단순한 미스터리물이라고 생각했던 영화와 다르게 심리법정극 드라마였다. 그 바탕에는 부부에 대한 이야기가 있는데 흔한 소재를 단순히 성별을 전환하여 이야기했음에도 불구하고 역할의 소비로 끝나지 않고 개인과 개인과의 관계성에 대해서 긴밀하게 탐구한다. 그 탐구의 세계는 개인에서 공동체적인 성격으로 사회에 대한 시선을 이야기하기도 한다. 그러면서 형체를 알 수 없이 산산조각난 관계를 조금씩 조립해가는 과정에서 알게되는 진실과 사실을 바라보는 점이 놀라울 정도로 아리다. 특히 시각장애인 아들인 다니엘의 입장에서 오로지 소리로만으로 판단하고 마주해야하는 점에서 주관과 객관을 잃지 않으려는 아이의 태도를 유려하게 잘 그려냈다. 어쩌면 모든 일들이 아들 다니엘과 비슷하다는 생각이 들었다. 볼 수 있어도 볼 수 없는 일들이 다분한 현실 사회에서 말이다. 저스틴 트위에의 탁월한 각본과 연출 그리고 산드라 휠러의 엄청난 연기 압권 추락사를 두고 해부하고 다시 이어 붙이는 엄청난 대사의 폭격. 산드라 휠러의 연기는 논외. 마지막의 아들 역할과 강아지 연기가 미쳤다. 스눕 독 연기 지린다 ㄷㄷ 사운드와 이미지 사이에서 요동치는 인식에 관한 정교한 해체. 🩸👩‍⚖️ 소설같은 스토리텔링으로 담아낸 한 부부의 초상. 보여지지 않은 것을 놓고 확신과 의심이 팽배한 줄다리기를 한다. 하지만 재판의 긴장감보다도 부부관계를 담아낸 시선이 정말 강렬하다 해부의 과정만 보여줄뿐, 결과는 보여주지 않는다. 진실이 없다면 편리한 상상 대신 고통스런 맥락을 택하라. 무엇을 위한 진실인가 해부된 것들은 어떤 방법으로도 원상복구될 수 없다 낙상으로 흥건한 의심과불신의 원심력에 뒤덮이다 보는 내내 놀랍다는 생각을 멈출 수 없었다. 재판이 진행되면서 평범해 보였던 한 가족이 철저하게 해부되어 난도질되는 광경을 관객으로써 목격하게 만든다
재판이 진행되면서 평범해 보였던 한 가족이 철저하게 해부되어 난도질되는 광경을 관객으로써 목격하게 만드는데 영화를 보는 동안 날카로운 메스나 피가 낭자하는 해부 장면이 등장하지 않음에도 마치 메스에 자신의 속마음이 낱낱이 해부되어 벌거벗은 채 많은 사람들 앞에 널브러져 있는 느낌을 받게된다. 추락할지언정 결정해야 하는 인간(3.5) 실제 현실을 보는듯한 카메라 연출이 인상적. 법정씬이 제일 현실감 있는데 그만큼 피로함.
누가 더 잘못했냐는 것보다 잘못된 만남이라고 밖에 할 수가 없었다. 흥미로운 점은, 매번 같은 직종의 부부 싸움에선 아이 문제나 집안일 문제를 여성이 문제삼는 것을 주로 봤었는데 남편이 주로 제기하고 유약한 모습을 보인다.
영화 '결혼 이야기'도 그렇고 결혼이 꼭 사랑의 결실은 아닌것같다. 적당한 거리를 유지하는게 서로에게 더 좋을지도... 추락하는 건 날개가 있다는데 도무지 안보여.
작가 부부로 살고 있는 사뮈엘 & 산드라 부부. 남편이 사는 프랑스 고향집에서 낡은 별장을 수리해 게스트 하우스로 꾸밀 예정이에요. (산드라는 독일 사람이지만 영어로 주로 대화하죠) 그들에게는 아들 다니엘이 있는데 교통사고로 시각 장애를 갖고 있고 스눕은 그의 반려견이자 시각장애인 안내견으로 지내고 있죠. 작가와의 인터뷰를 요청한 여대생과 인터뷰를 할려던 찰나 사뮈엘이 틀어놓은 음악소리에 산드라는 인터뷰를 포기합니다. 다니엘과 스눕이 산책에서 돌아오고 아빠 사뮈엘이 피를 흘린채 싸늘한 주검이 된 것을 발견하죠. 오래전 알고지내던 변호사 뱅상이 이 사건을 맡아주는데 아무리 여러번 시뮬레이션도 해보고 경찰과 함께 사건을 알아보지만 석연치 않은 점이 많죠. 하지만 의뢰인을 믿어야하는 만큼 허점을 찾는데 주력합니다. 두 사람이 싸운 내용이 담긴 음성파일이 발견되면서 산드라에게 불리한 상황. 다니엘도 어느게 진실인지 혼란스럽기만 합니다. 검사의 날카로운 심문을 방어하고나니 어느덧 다니엘의 진술 순서가 되었습니다. 과연 진실은 무엇일까요?

남편의 추락사가 사고인지 타살인지, 자살인지를 증명해야 하는 아내의 이야기. 진실도 중요하지만 믿음이 진실로 이어질 수 있는가의 의문도 보여주죠. 누가 범인인가에서 어째서 왜 이들은 이렇게 되었는가 등의 꼬리에 꼬리를 무는 질문들이 이어지죠. 3층이자 다락방에서 추락사, 산드라의 특별한 취향과 자녀 양육 문제, 남편의 작품을 표절한 상황 등등 정황상 모든게 산드라에게 불리하게 작용되는데요. 어쩌면 아들 다니엘이 유일한(?) 목격자이기에 그의 진술이 의외로 판결을 뒤집는 상황임을 보여주죠. 사실 부부싸움 장면은 전반부에 빨리 보여주었다면 이야기가 금방 이해되었을 법한데 의외로 사건발생 1년 후 시점에서 패를 늦게 까는 방식을 선택합니다. 심지어 격렬한 싸움은 아예 사운드만 나오죠. 그것도 그럴것이 앞에도 말씀드렸다시피 이것은 동영상 파일이 아닌 사운드 파일입니다. 충분히 상상의 나래를 펼칠 수 있고 뒷부분의 격렬한 사운드가 진짜인 것이죠. 다니엘이 스눕을 가지고 아버지가 극단적인 선택을 하려던게 진찌인지 확인하는 장면 이후에서는 산드라를 신뢰하지 않을 것 같지만 다니엘을 보호하는 법원직원과의 대화에서는 확실히 결심한 듯한 모습을 보입니다. 스놉도 아들 다니엘을 계속 보호해줄 수 없다는 말 뒤에 묘한 여운을 남긴 사뮈엘의 대화에서 그는 어느 정도 확신했는지도 모르죠. 그리고 그 판결 결과가 나온 순간 해피엔딩이지만 결코 해피하지 않은 상황을 맞이하게 됩니다. 사이다를 마시고 트름이 나올 것 같은데 어딘가 막힌 그런 찝찝함이죠. 어쩌면 쥐스틴 트리에 감독의 전매특허인지도 모르겠습니다. 전작 ‘시빌’을 기억하신다면요. (아참, 두 영화 모두 산드라 휠러가 출연했죠.) 양립된 두 세계가 낱낱이 파헤쳐지며
사망사건으로 시작된 영화이기에 아내가 용의자가 맞는지 아닌지를 염두에 두고 봤지만, 깊이 빠져들면서 하나로 합쳐질 수 없는 부부의 관계를 낱낱이 해부하는 과정에 깊이 몰입했다. 촘촘하게 짜인 이야기가 영화에 몰입을 하게 했고, 밀도 높은 긴장감을 선사해 151분이라는 러닝타임 내내 지루한 줄 모르고 빠져들었다.
여기에 주연인 산드라 휠러는 진실을 숨긴 용의자와 억울한 피고인이라는 두 얼굴을 연기하며 마음을 어지럽혔다. 또한 시각장애를 가진 다니엘을 연기한 밀로 마차도 그라너의 연기도 인상적이었고, 똑똑한 개 스눕(본명 메시)은 칸영화제에서 팜도그상을 수상했을 만큼 영민함을 보여줬다.

추락한 부부의 세계를 낱낱이 해부한 이 영화를 보고 나니 부부 관계를 감성적으로 다룬 여러 작품이 떠오르기도 했다. 역시 황금종려상이라는 생각을 공고하게 한 작품이었다.
리뷰 전문 보기 시작부터 하강하며 관계에서 개인으로 자아로 점으로 조각낸다 '사실-남편이 추락해서 죽었다/진실-?' 왜보다는 어떻게에 시선이 팔려버린 사람들에게 보여주고 싶은 누벨바그 향기 진하게 풍기는 명작. '공동제공: 키노라이츠' 이 문구부터 이미 눈이 번뜩였다 (240114 씨네Q 신도림점 프리미어상영) 진실성에 대한 것도 부증명의 상황에 들어서면 취사선택이 될수도 있다 어떻게 그렇게 됐는지 판단할 정보가 부족하면 정황을 봐야한다. 추락의 해부에서 관계의 해부로 이어지는 전환이 물흐르듯 좋은 작품. 추락 사건을 해부하는 굉장히 철학적인 영화"
초콜릿 천국," 하염없이 돌려본 이 영화에 나오는 모든 노래들과 모든 장면들이 싹 다 기억에 남는다. 달콤한 노래와 형형색색 사탕이 있는 진 와일더의 초콜릿 천국
로알드 달의 '찰리와 초콜릿 공장'의 첫 영상화 작품. 곧 개봉 예정인 <웡카>의 예고에 등장하는 움파룸파의 디자인이 <초콜릿 천국>과 같아서 연관이 있지 않을까 싶어보게 되었다.

영화의 스토리는 큰 흐름은 원작을 따라가되 몇몇 변경점들이 보인다. 특히 새로 추가된 변경점들 덕분에 원작과 다른 방향으로 풀어나가는 스토리가 특별하게 느껴진다.

영화 간 비교를 하는 후기는 되도록 지양하는 편이지만, 다른 매력을 뽐내는 역대 '웡카' 캐릭터에 대한 얘기를 하지 않을 수 없다. '조니 뎁'의 웡카는 트라우마를 가진 천진난만하고 정신나간 어린이의 이미지로 인간적인 면모를 조여준다면, '진 와일더'가 표현한 웡카는 차분하고 어딘가 의뭉스러운 어른의 이미지다. 성격의 차이는 두 배우의 연기뿐만 아니라 무대 장치에서도 들어난다. '조니 뎁'의 설탕 배가 후룸라이드였다면, '진 와일더'의 설탕 배는 귀신의 집이다. 온갖 공포스럽고 혐오스러운 장면이 갑자기 재생되어 놀랐었다. 하지만 그런 괴팍한 면모를 보이기에 영화의 말미에 '진 와일더'가 짓는 미소가더 진실되어 보인다.

<초콜릿 천국>에서 표현된 공장 밖 현실세계는 지극히 평범한 세상이다. 등장인물들도 개성이 강하게 표현되었을 뿐이지 현실적인 이미지라고 느껴졌다. 그렇기에 괴짜스러운 옷을 입은 웡카의 등장은 현실이라는 연못에 비현실이라는 보라색 물감을 떨어뜨린 느낌이다. 그의 등장과 함께 비현실적이고 신비로운 세계가 열린다.

움파룸파 족은 단신 배우들로 구성이 되어있다. 주황빛 피부와 초록빛 머리색, 흰 눈썹으로 통일된 모습으로 만일 이러한 분장을 하지않았다면 같은 종족이라는 느낌이 들지 않았을 것 같다. 영화를 더욱 판타지스럽게 만드는 요소이다. 이들이 부르는 4곡의 노래는 같은 곡조에 가사가 달라지는 것으로 '움파룸파 둠파디두'라는 중독성이 강한 후렴구가 매력적이다.


좋았던 대사 ""지친 세상에서 선행이 빛을 발하는구나""

급속도로 메말라가는 현실에 정말로 필요하다고 생각한 문장. 돈보다 소중한 가치가 있음을 언제나 망각하지 않기를 어린이에게 한층 지독하게 달콤한 로알드 달의 블랙 유머. 로날드 덜도 웃음 짓겠어. 움파룸파 둠파디 두~~ 팀버튼 보다도 더 기괴함이 엿보이는 상상력의 세계. 잊혀져도 딱히 상관없는 옛날의 그저 그런 할리우드 뮤지컬
난 이 영화에 전혀 불만이 없다. 그래도 언제나 팀 버튼 버전이 최고라고 생각해왔다. 이 버전도 재미는 있으나, 엄청 대단할 건 없다고 생각함. 하다못해…… 원작의 팬들이 이 말을 들으면 극대노하겠지만, 로알드 달이 적은 소설보다 팀 버튼 영화가 100배 훌륭하다고 생각한다.

차이점이라면…… 이 1971년도 영화는 원작 줄거리에 더 충실한 편이다. 물론 그 왕사탕 얘기가 더 추가되었긴 했지만, 전혀 원작에 흠집을 내지 않았다. 그게 그나마 즐길 점이라나?

그런데 난 팀 버튼하고 대니 엘프만이 너무나도 훌륭하게 재해석했다고 생각해서…… CG나 상상력이나 음악으로나 연기로나 여러가지로 말이다. 사실 원작이 뭐 엄청나게 깊이 있는 주제의식을 갖고 있는 것도 아니잖아? 또한 로알드 달 특유의 괴팍한 상상을 스크린으로 옮기려면, 팀 버튼처럼 괴짜 같은 인간이 연출직을 맡아야 한다. 반면에 이 영화는 그 옛날의 올드한 브로드웨이 갬성이다. 아니 그것도 나름 멋지긴 한데, 엄청 특출난 것은 없다."
