titles,reviews
가재가 노래하는 곳," 미스터리 요소는 약했으나 실망을 했다기 보다는 폭력적인 관계로부터 주인공이 대처해 나가는 과정에 집중하게 되고 '습지'라는 독특한 배경 설정에서 오는 신비로운 분위기가 볼만했다. 제목이나 포스터만 보면.. 아름다운 자연 속의 어떤 주인공의 감성적인 이야기 같았는데, 습지에서의 죽은 한 청년의 수사로 이야기가 시작된다.
제목이나 포스터만 보면..
아름다운 자연 속의 어떤 주인공의 감성적인 이야기 같았는데,
습지에서의 죽은 한 청년의 수사로 이야기가 시작된다.
습지에서 자란 소녀 카야.. 그녀의 이야기는 참 외롭고 고독했지만,
강해지는 법을 배우고 껍질에서 나오는 법을 배우고...
그리고 사랑을 하게되며 점점 삶을 습지의 생명체들과 같이
확장하고 성장한다.

그녀에게 삶의 방식은 습지의 생태계나 다름이 없었다.

꽤 괜찮게 본 영화.
로맨스 부분은 <블루 라군> 의 느낌도 살짝 나고, 법정 드라마 씬 장면들도 좋아하는 요소. 영화 속 미국의 시대적 문제였던 인종차별, 여성에 대한 차별 사회적 무시 등등의 복합적인 문제들이 뒤엉킨 큰 타래를 보여준다. 소설을 영상화했다는 사실을 숨기지 않고 욕심 부리지 않아 훌륭한 영화는 못 되지만 책 한 권 잘 읽은듯한 감상을 준다 매력적인 여주와 아름다운 풍광에 매료돼서 끝까지 몰입하게 된다. 잔혹동화로 시작해서 디즈니 프린세스 영화를 지나 더글로리로 끝나는 영화. “자연에 선과 악이 있는진 모르겠어요. 그저 살아남기 위한 방법들이죠. 환경이 환경이니만큼요.“ 가재의 노래를 듣는다는 건, 그 삶을 존중한다는 것. 자연의 이치를 가장 빨리 깨달은 이가 자연의 방식을 다룬다. 가재가 노래하는 곳으로 가고싶은 그녀 스토리와 영상미가 있으니 (넷플에서) 볼 수 있을 때 보시길. 처음부터 끝까지 긴장감이 있는 습지의 삶, 카야. “긴장감마저 습지 저 너머로“
영화 속에 필요했던 사건의 진실과 스릴적 느낌이
밀물과 함께 가라앉고, 썰물과 함께 쓸려 내려갔다.

뻔한 트릭과 범인이라는 걸 알기 쉽게 알려주는
대사들 덕분에 더 이상의 추리 영화가 되지 못했다.

남들과는 동떨어진 곳에서 자연처럼 생활하고
그곳이 편한 그녀 역시 자연 그 자체로 본다면
그러한 행동들은 범죄가 아닌 그저 살아가기 위한
하나의 방식으로 볼 수 있다.

자연은 수많은 상호 관계와 끊임없는 먹이사슬을 통해
변화와 유지를 반복하며 생존을 이어나간다.
자연은 인간이 생각한 것보다 체계적이고 영리하다. 묘하게 집중하게 되는 영화, 배우의 매력 덕분. 스릴러라고 잘못 알고 봐서 조금 당황스러웠지만 아련하고 아름다워서 기억에남는다 가끔은 이런 클래식 드라마가 필요해. 갠취 미국남부 습지풍광과 예쁘고 (노멀피플의 그녀) 잘생긴 배우 (슬픔의 삼각형의 그),원작 스토리의 힘 덕에 킬링타임용으로 나쁘지않음. 영상미를 통해, 카야의 삶을 통해 습지 라는 환경을 납득시킨다.
영상미를 통해, 카야의 삶을 통해 습지 라는 환경을 납득시킨다. 만
늪도 있지만, 빛이 들어오기도 하고, 하늘과도 닿아있는, 다 모여있지만 그 애매한 습지의 분위기로 영화가 처음부터 끝까지 간다는 점은 좋은 마무리이면서도 아쉽다.
+ 습지와 연관지어져서 나오는 대사 하나하나가 좋았다. 습지의 섭리가 곧 그녀의 방식으로 예상가능한 반전임에도 불구하고 카야의 감정선 묘사는 좋았다. .
23 02 03 선택한 적 없는 가혹한 습지 먹이 사슬 최하층의 삶. 초반의 몰입이 좋아서 기대했는데 중반부터 축 늘어지며 이입시키지 못하는 흐름이 많이 아쉽고 3D 패턴이 바로 읽히거나 인물과 CG에 이질감이 드는 등 CG에 돈이 많이 안 들어간 게 눈에 보이는 것도 아쉬웠다. 엔딩 크레디트에 흐르는 테일러 스위프트의 Carolina가 영화랑 정말 잘 어울리고 축축하다. 자연에는 선약은 없고 살기 위한 선택이라는 주제가 삼각 로맨스에 파묻혀 빛나지 않는다. 소재는 있지만 부족한 치밀함은 아쉬움을 자아낸다. [2023. 2. 19 일요일] 사람들은 자연을 마음대로 떠나 방치해두더니 다시 마음대로 침입해 짓밟는다. 포식자라 우월감 느끼던 인간들은 언젠가 심판 받는다. 모두가 떠나는 이 곳은 고독으로 가득하지만 끊임없이 사랑이 피어오른다. 약자를 다루는 사회의 시선을 대상의 눈으로 바라보는 아름답고 비극적인 미스터리. 혼자라고 생각 말기 미국식 전기 위에 쓰여진 환경 생존기. 습지는 외롭고 강인했다.그게 바로 카야 이다."
나의 행복한 결혼," 오싱과 이세계물의 ""잘못되지 않은"" 순수한 만남!
#나의행복한결혼

넷플릭스에서 12부작으로 스트리밍 중인 <나의 행복한 결혼>이 동명의 영화로도 개봉합니다. 원작은 라이트노벨이네요. 작가 #아기토미아쿠미

한국에서는 3부까지 정발되었고, 일본에서는 7부까지 나온 모양입니다. 시리즈 누계가 800만 부가 넘었다고 하니, 초히트 작품입니다. 여담입니다만, 소설가가 되자 연재작이었던 걸 감안하면 정말 격세지감의 모습을 작가도 극중 주인공처럼 느낄지도 모르겠습니다. #코사카리토 연재하는 코믹스는 4권까지 발매되었네요.

로맨스에서 절대 지존의 플롯인 #신데렐라스토리 입니다. 얼마 전 제가 이 애니 평을 하며 <#오싱>의 이세계물 버전이라고 말한 적이 있어요. 뭐 그렇고.



#쿠도키요카 라는, 무자비한 폭군으로 소문난 젊은 군인에게 정략적으로 약혼자로 보내진 #미요 미요는 사이모리 가문에서 버리는 카드로 내민 계획의 일부입니다. 그도 그럴 것이 쿠도 가문에 약혼자로 보내진 여인들은 저마다 사흘을 견디지 못하고 집을 나갔다는 소문이 자자했기 때문입니다.

미요는 견귀 능력이 나타나지 않았고, 집에서는 하인처럼 살았습니다. 참고 버티는 것으로 쉽게 포기하는 것으로 그렇게 언제든 천국에 있는 엄마의 곁으로 가길 바라며.

그러나!

쿠도와 미요가 실제로 사랑을 하게 되며 모든 일들이 틀어지고 벌어지기 시작합니다. 그런 가운데서 미요가 꾸는 악몽이 이능력 발현의 계기가 되고, 여기에 음모가 더해지며 쿠도와 미요에게 절대절명의 사건이 터집니다!!!

뭐 이 정도가 줄거리고.

일단 로맨스는 착하지만 여린 미요가 쿠도의 마음을 열고 사랑을 나누는 로맨스가 순수하게 그려졌습니다. 저 같은 아저씨가 ""저며 든다""라고 표현할 정도로 순수하고 설렐 정도입니다. 이게 영화든 드라마든 즐겁게 보게 만든 바탕이었던 듯합니다. 여기에 이세계 판타지가 합쳐지며 대중적 흥미도를 확연히 높여줍니다.

막강한 힘을 가진 쿠도마저 결국에는 미요의 힘을 빌려 난국을 타개하는 모습은 그것으로 즐거웠거든요.



애니메이션과 영화를 굳이 비교해보면, 로맨스라는 몽실몽실한 분홍색 작화 분위기를 잘 살려낸 것은 애니가 위, 기승전결의 구조를 살려 하나의 이야기로 완성도가 높았던 것은 영화였습니다. 둘 다 볼 만했습니다.



관람하려는 분들은, 애니든 영화든 크게 허들이 높지 않아서 어느 것이나 먼저 보아도 될 듯합니다. 그렇게 구박 받던 여주인공이 엄청난 능력자라는 게 재미있었고, 그 능력으로 또 사랑하는 약혼자를 구할 때는 짜릿했습니다. 물론 고구마 같은 꽉 틀어막힌 상황과 죄송합니다, 를 연발하는 미요를 보면 많이 답답합니다. 그러나 금세 주인공이 행복해질 것을 알고 보는 것이기에...!



객석 분위기가, 뭐랄까, 싱어롱 분위기였어요. 영화가 다 끝났는데도 한 분도 안 나가고 나중에 상당한 관객이 살짝살짝 손뼉치며 주제가를 따라 부르더군요. 심지어 옆자리 하이틴으로 보이는 세 명 여학생은 율동까지 맞추어서! 와. 이런 상영 분위기에 관해 이야기만 듣다 직접 경험해 보니, 재미있더라고요.


올 가을, 비슷하지만 다른 로맨스 하나 보시겠다면 추천합니다. 막 마음이, 잔잔하니 몽글몽글 해지는 게, 순수해지는 로맨스라고 할까요. 많이들 재미있게 보시기 바랍니다. 흥행하세요.
리뷰 전문 보기 일본 특유의 오글거림을 견뎌낼 수 있다면 괜찮은 판타지 수작. https://blog.naver.com/vegeta78/223249919331 이세계물 전혀 관심 없었지만, 배우의 연기에 끌려 재밌게 봤음
- 이세계물 장르에 나름의 세계관이 있으나 딱히 그쪽 장르에 관심은 없었으나
- 엄청 오글거릴 수 있는 장면들이지만 그리 거부감 없었고 무엇보다 여주인공 역의 이마다 미오가 감정선을 너무 잘 살려서 눈물나게 연기를 잘해서 인상에 남는 작품였음.
(이미 CF 퀸으로 나름 잘 나가고 있지만 배우로도 더 잘 됐음 좋겠음.
보고나서 유무상 팝콘 응원도 하고 있음) 유치한 클리셰의 집합체 같은 영화인데 그래서 좋았다. 다만 오글거리는 헤어스타일과 cg는 좀 힘들어서 애니로 보는게 훨씬 좋을것 같다. 23.10.20. 메가박스 부산대 조금더 중2병스러움을 덜어냈더라면 원작의 캐릭터나 배경을 잘 구현해 실사화. 단 액션과 CG 부분에 아쉬움은 남는다. [나의 행복한 결혼] 짧은 관람 후기
아기토기 아쿠미 작가의 라이트 노벨을 실사 영화화 한 작품인 '나의 행복한 결혼'을 관람하고 왔습니다.
이것저것 불필요하다 생각되는 부분들은 과감하게 걷어내고 알맹이만 뽑아쓰는 각색을 했는데 튀지않고 자연스럽게 잘 붙여서 꽤나 매끄러운 작품을 만들어냈습니다. 나름의 오리지널리티가 느껴져서 참 좋았습니다.

개인적으로 이능력을 실사로 표현함에 있어 손발이 오그라들것을 예상했었는데 생각보다 꽤나 근사하게 잘 뽑혀서 많이 놀랬고 남녀 두 주인공의 캐미와 감정선을 섬세하게 잘 표현한 점도 좋더군요.

다만 후반부에 그려지는 액션 연출을 좀 더 세심하게 그려냈으면 어땠을까라는 아쉬움이 살짝 들었습니다. '행복'은 생각지도 못한 순간에 우연히 내 마음에 다가와 포근히 쌓인다.
<나의 행복한 결혼>을 관람하였다.

메구로 렌과 이마다 미오의 케미도 좋았고
무엇보다 이마다 미오의 '미요' 캐스팅이 적절했다.

원작의 내용을 품고, 적절한 각색과
애니메이션의 '파스텔 톤'이 아닌
또 다른 느낌의 '색'으로 구현된 영화였다.

'이능'을 활용한 액션의 활용이 돋보이고
'음양사'가 생각나는 스산한 분위기가 깔려있어서
애니메이션과는 사뭇 '결'이 다르다고 생각할 수 있겠으나

원작과 마찬가지로 이 '영화' 역시

모진 말과 잔혹한 행동들로 상처받아
마음이 무너지고 의지할 곳 하나 없이
힘든 하루하루를 보내던 '미요'가

운명처럼 찾아온 '정략 결혼'을 계기로
사랑받고, 사랑하며 행복해지는 과정을
따뜻하게 잘 그려낸

좋은 작품이었다.

----------------------------------------------------------------------------------------------
■ 화면 비율 : 1.85:1
[1회차 : 메가박스 코엑스 10관 - 2023. 10. 11]
---------------------------------------------------------------------------------------------- 애니와 달리 이능을 쓰는 장면이 cg로 처리되어 이질감이 들지만 나름 실사화 잘 되었다 이게 바로 일본의 로판!
개봉을 앞둔 영화 <나의 행복한 결혼>은 라이트 노벨이 원작이고 만화책으로 출간되었으며, TV 애니메이션 시리즈로도 나온 작품이다. 그렇게 많은 콘텐츠가 있지만 모두 접해보지 못했고, 간단한 줄거리 외에는 아무런 정보 없이 영화를 보기 시작했다. 모르고 보는 걸 선호하는 편이니 말이다.
그런데 보는 동안 군데군데 이야기가 빠진 부분이 있다는 게 느껴졌을 만큼 자연스럽지 않은 전환이 도드라졌다. 관련 콘텐츠를 접하지 않았는데도 불구하고 이야기의 허술함이 느껴졌던 걸 보면 각색이 조금은 별로였다. 원작이나 다른 콘텐츠를 접한 사람, 재미있게 본 사람이라면 아쉬울 것 같다는 생각이 들었다. 그러면서 느꼈던 건 영화가 아니라 드라마로 나오는 게 훨씬 잘 어울렸을 거라는 것이다. 쿠키 영상으로 영화 시리즈에 대한 가능성을 열어뒀지만, 그래도 드라마가 나았을 듯하다.

영화를 보는 동안 일본 멜로 영화에 면역력이 유독 약한 나는 특유의 오글거림을 참을 수가 없어서 어색한 웃음이 피식피식 터져 나왔었다. 더군다나 로맨스 판타지라 일상을 뛰어넘는 그 오글거림이 조금 부담스럽기도 했다. 그런 스타일의 영화라고 마음을 다스렸더니 그래도 나중엔 익숙해졌다.
두 배우의 비주얼과 연기가 좋아서 나쁘지 않았다. 올해 너무 괜찮게 본 드라마 <사일런트>에 출연한 메구로 렌은 이 영화에서도 좋은 연기를 보여줬다. 그리고 이마다 미오 역시 역할에 잘 어울렸고 연기 또한 좋았다.
리뷰 전문 보기 나의 행복한 결혼 사사회 후기
수준급의 CG, 연출, 장면전환 부분에서 놀랐구요
배우분들의 수준급 연기 덕분에 작품에 더 몰입했습니다
엔딩 크레딧의 Ost가 너무 좋았습니다
그리고 일본 로맨스물 특유의 느끼한 느낌이 없고 깔끔했네요

그런데
원작 특성상 차분하고 좀 느리게 스토리가 진행되기에 따분하게 느낄 수도 있겠다고 생각이 드네요.
원작의 각색이 엄청 많이 됬습니다.
미요의 능력을 이렇게 쓰고 끝나다니...원작에 비해서는 임팩트가 떨어지네요...이로 인해서 감동이 좀 떨어지네요
결말이 완전히 달라지네요

쿠키 영상 : 있음

총평 : 그래도 다른 실사화 영화보다는 훨씬 좋은 퀄리티를 보여주지만 각색이 좀 많이 들어가 실망하시는 분도 있을것 같네요 각성한 신데렐라는 인셉션에서 화염룡의 품에 안기고...😎 유치한듯 하지만 어느덧 집중하게 되는 로맨스판타지물 달콤한 연애 참 보기 좋아~ 너무 재밌게 보고왔습니다. 애니를 보고 가서 그런지 더 재밌었음 원작과는 다르게 각색된 부분이 있으나 이 정도면 관객들이 납득할 만한 정도라고 생각된다. 미요 역을 맡은 이마다 미오는 원작 초월이라는 생각이 들 정도였다. 답답한 부분들을 많이 거둬내고 필요한 부분만 뽑아서 각색을 잘했다고 생각했다. CG가 어색하지 않아서 놀랐음.
원작,애니,실사영화가 각각 다른 점들이 있어서 비교하면서 감상하기 좋은 작품인 것 같다.
보기 전까지 가발이랑 CG부분이 어색하지 않을까 싶었는데 생각보다 자연스럽게 흩날렸고 이능력CG가 자연스러워서 굉장히 신경써서 만들었구나 싶었다.
츠카하라 아유코 감독 작품은 작품마다 팬들이 많은데 그이유를 알 것 같았다.
미요키요카 두사람이 점점 서로에게 빠져드는 것을 섬세하게 담아줬고, 키요카 부대랑 황실 쪽의 무게감이 달라서 밸런스가 잘맞는 작품이라고 생각되었다.
그리고 쿠키영상을 보고 속편에 대한 기대감이 차올랐는데 꼭 속편이 나와줬으면 좋겠다🙏🏻"
