titles,reviews
황야," 콘유 세트장에 반도 세계관을 끼얹고 부산행이나 범죄도시나 베테랑 그 아무데서나의 마동석을 얹어놓으면 뚝딱완성.
이건 세트장만 황궁아파트지 콘유 세계관이라고 하는게 부끄러운 작품이다. 영화 틀자마자 강렬하게 드는건 오히려 반도의 기시감. 무슨 영화든 무슨 시리즈든 마동석을 얹는 순간 그냥 그 작품은 저스트 아트박스 사장 마동석 유니버스에 불과해진다. 작품 퀄이나 분위기가 모두 마동석화 돼버리는거다. 도대체 뭘 위해? 왜 전부 다른 작품에 나오는데 다 천편일률적이고 획일적인 마동석인건데? 한 골백번은 어디서 본 거 같은 전혀 고민 없는 매드 사이언티스트의 비뚤어진 사명감. 지겹고 질린다. 같은 아포칼립스여도 충분히 다르게 만들 수 있을텐데. 프로덕션조차 전혀 새롭지 않다. 왜 원작 웹툰 작가가 각본을 썼는데 콘유랑 이토록 다른 결과물이 나오는가. 허명행 무술감독의 장편연출 데뷔작을 기대했는데 액션 시퀀스조차 눈길이 가지 않는다. 그저 잔인하고 자극적이고 의미 없는 구타의 지리멸렬한 반복과 나열. 거친 모래바람이 날리는 황야를 달리는 것이 아니라 그저 일직선의 평탄한 포장도로를 달린다.
거친 모래바람이 날리는 황야를 달리는 것이 아니라 그저 일직선의 평탄한 포장도로를 달린다.

무술 자체는 모르겠으나 캐릭터는 하나같이 무색무취였으며, 각본은 그 진부한 각본마저도 엔딩 시퀀스에서 전부 봉합해 내지 못한다. 권선징악의 플롯을 취하며, 고전적인 스토리텔링 방식을 차용하면서 그마저도 깔끔하게 사용하지 못했기에 작품성을 포기하고 보더라도 장르적인 측면에서도 실패한 영화라고 보인다. 앞으로의 마동석 주연작들에 빨간불 유일한 장점의 매력마저 너프시키는 게으른 만듦새 콘크리트 유니버스에서 펼쳐지는 액션. 마동석의 액션을 좋아한다면 재밌게 볼 수 있을 것. 개인적으론 살짝 질린 ㅎ 장르 : 마동석 마동석 주연하면 다 좋아할 줄 아는겐가?? 맥락도 없고 그냥 주먹만.. 콘크리트 유니버스에 마동석은 영 안 어울린다.
원래 마동석 영화는 개연성 없고 현실성 없고 인물들 행동에 이유가 없다. 마동석 영화 속 모든 이들은 그저 액션의 쾌감을 더하기 위한 부속품일 뿐이다. 그게 나쁘다는 건 아니다. 그런 영화를 대중들이 좋아한다는 걸 우리는 범죄 도시 시리즈에서 지켜보았다.

개인적으로 마동석이 계속 펀치 날리는 영화 찍을 거면 영화계에서 아예 따로 놀아야 한다고 생각한다. 2023년의 역작 '콘크리트 유토피아'가 멋지게 끊어놓은 콘크리트 유니버스의 탄탄한 세계관을 '황야'가 한방에 무너뜨렸다. 만약 콘크리트 유니버스 소속이 아니었다면 그럭저럭 0.5점이라도 더 줄 수 있었을 것이다. 시원한 액션 덕분에 넷플릭스에 올라오는 오락 영화로는 나쁘지 않다.

아무리 감독이 다르고 '콘유'와는 아예 다른 이야기라지만, 황궁 아파트를 재활용하지 않았는가? 유니버스의 흥행을 위해서 좀 더 신중할 필요가 있었다고 본다. 사람들이 기대하던 세계관의 장점은 모두 사라지고 뻔한 액션만 남았다. 도대체 언제쯤 한국에서 제대로 된 시리즈 세계관이 구축될 수 있을는지...

흥행배우 마동석에, 히트작 콘크리트 유토피아의 후광을 등에 업고 영화관 개봉을 할 만도 했건만, 롯데엔터테인먼트가 영화관 개봉을 포기한 데는 다 이유가 있었다.

#그래도 노정의, 이준영의 연기는 좋았다.
#이건 뭐 스위트홈보다 개연성이 없으니
#잔인한 건 또 왤케 잔인한지 마동석은 라면스프임. 모든 장르를 다 집어넣어도 마동석만 들어가면 마동석 유니버스. 마동석 먼치킨물 추가. 넷플릭스가 영화에 돈을 투자한게 아니라 돈이 남아 돌아서 투자한 느낌 뻔하지만 마동석 액션,유머,드립 없었으면 망했을듯 결론 생명연장 시켜준 마동석 상상력의 결여. 부산행인가 스코치트라이얼인가 레지던트이블인가 된장찌개일것 같았는데 청국장이었다 세상이 멸망하더라도, 마동석표 액션은 생존하리리 거침없는 액션 통쾌한 액션!!!! 그리고 황폐화된 지구에 살아가는 생존기(?) 근데 자꾸 범죄도시가 떠오른다……………….. 통쾌한 액션을 좋아한다면...재밌게 볼 수 있다. 마동석액션을 좋아한다면 특히~ ???: 네가 그 사냥꾼이냐? ???: 그럼 사랑꾼이겠냐?
킬링타임용으로 보기 정말 편하고 재밌지만 아쉬운 점이라고 한다면 스토리의 빈약함이 아닐까싶다.
거기에 더해지는 잔인함. 그러나 이 잔인함과 비례하는 액션의 화려함은 빨간불 가득한 이 작품에서 찍어주고 싶은 초록불 방점이다.

본편이 콘크리트 유토피아였다면 이건 아마 스핀오프의 오프의 오프 정도?(감독님 피셜 두 작품은 아예 관련이 없다고 한다)

차라리 양이 길어지더라도 6-8부작 정도의 드라마로 나왔으면 어땠을까 싶기는 하다.
공간감이 분명 넓은데 코앞에서만 놀고있는 느낌을 지울 수 없는 것도 아쉬운 부분이긴 하다.

그렇지만 액션의 타격감은 이보다 좋을 순 없다. 스토리를 포기한 대신 액션의 광활함을 선보이는 작품이었다 볼 수 있겠다.

이로써 장르가 마동석이라면 잔인함과 유쾌함이 공존할 수 있는 킬링타임용 작품이리라. 이 영화 안 본 눈, 제가 살게요!
영화 <황야>는 작년에 개봉해 평단과 대중을 모두 사로잡은 영화 <콘크리트 유토피아>의 세계관과 연결된 영화라 궁금했었다. 여기에 포스트 아포칼립스와 생체실험으로 좀비인지 뭔지 모를 인간이 된 괴물들, 지성과 강인함 등의 권력을 휘두르는 악인과 인간이 가진 선함으로 움직이는 사람들 등 온갖 요소들을 다 담고 있었다. 클리셰라고 할 수도 있겠지만 이런 배경을 가진 영화의 기본 설정이라 어느 정도는 이해할 수 있었다.
그런데 이런 것들을 담아내고도 재미를 손톱만큼도 찾을 수가 없어서 정말 깜짝 놀랐다. 취향의 문제가 아니라 그냥 재미가 없었다. 눈길을 끄는 캐릭터가 있는 것도 아니었고, 개연성을 따지고 싶지 않지만 허술한 구석도 너무나 많았다. 거기다 허명행 감독이 무술 감독 출신이라 액션을 기대했는데, 액션도 그렇게 인상적이지 않았다. 다른 영화에서 봤음직한, 약간의 잔인함에 치중한 것들뿐이었다.

평이 워낙 안 좋아서 전혀 기대하지 않고 본 영화인데, 생각보다 더 별로라 당황스럽다. 이 정도로 재미가 없을 줄은 몰랐다. 최근 몇 년 동안 본 한국 영화 중에 가장 별로다.
리뷰 전문 보기 B 오히려 콘크리트 유니버스에서 빠진게 다행일수도. 무술감독의 감독도전기는 망했다. 어디서 본거같은 화면만 우구장창 어설픈 cg와 타격감없는 액션까지 싸움장면은 많은데 흥미롭진않다. 서사 케릭터구축 감정이입까지 1도안된다. 콘크리트유토피아 세계관이라더니 결국엔 마동석 유니버스. 허명행 무술 감독 출신의 액션'만' 지리는 영화 지이이이이이이인짜 볼거없을때 보면ㅇㅋ 책임지지 않을 세계관이었다면
장르가 마동석이라는 말에 크게 벗어나지 않는 오로지 마동석 의존 영화로 그런 영화들과 크게 다른게 있다면 핵주먹만 쓰는 마동석이 아니라 총기 액션을 선보이면서 조금은 다른 모습을 볼 수 있다는것과 전체적으로 액션 하나에는 진심인 영화라는 것이다. 개연성은 당연히 필요없고 마동석 혼자만 활약하면 너무 뻔하니까 안지혜 배우 등이 액션을 계속 선사해주는데 분명히 액션에게서 오는 쾌감은 존재하는 영화지만 그것만을 위한 영화로 보기에는 큰 틀이 너무 아쉽다.

마동석이 가진 이미지도 다른것도 전혀 문제가 될것 없이 오락용 장면만은 시원한것은 분명하나 콘크리트 유토피아를 기반으로 같은 세계관 유니버스 속편으로 기획 된 영화라는것이 가장 큰 문제이자 발목을 잡는 포인트였다. 홍보를 할때 왜 유니버스 활용을 안할때 부터 알아봤지만 누가봐도 속편으로 만든 영화라는 것을 알기에 어차피 책임지지 않을 세계관이었다면 그냥 완전히 별개의 영화로 만들지 싶더라.
리뷰 전문 보기 세상이 멸망한 지 삼 년이 지나고 그간 깨끗한 물도 못 먹었다는 애들이 무슨 내가 본 디스토피아 중에서 제일 유쾌하게 살고 있네. 즐거워보인다니 좋은 일이네요... 황야의 무법자로 변신한 마동석을 보는 재미만 쏠쏠하다 앞으로 이 아파트를 더 많이 보게 될 것 같은 예감. 콘크리트 유니버스라는 세계관에 대한 상상보다는 '범죄도시 4'는 굳이 볼 필요 없겠다는 짐작. 마동석이 액션을 하니 유치하고 성의 없는 상황과 캐릭터는 이해하라는 듯한 제작진의 태도에 화가 난다. 콘크리트 유토피아가 아니어도 할 수 있었던 이야기"
웡카," 눈은 즐겁지만 귀는 즐겁지 못한
말 그대로 눈은 즐거운데 귀는 그리 즐겁지 못했던 영화이다. 초콜릿의 달콤함과 황홀함이 가득 차있는 동심의 세계였지만 노래 실력은 잘 모르겠는 티모시 샬라메의 매력속에서 넘버 자체가 귀에 확 들어오는 매력이 없다보니 눈과 귀의 즐거움이 좀 따로 놀았던 영화였다. 달달함에 그저 빠져들어도 모자란 시간에 위기가 너무 지나치게 반복적으로 찾아오고 그것을 해결해나가는 과정 속 기본적으로 깔려있는 유치함을 황홀함으로 커버하기에는 머리 속에 이미 박혀있는 또 다른 웡카가 더 매력적이게만 남아있었던 영화.

초콜릿이라고는 가나 초콜릿 말고 몰랐던 어릴적 시절과 지금이랑 비교하기는 힘들지만 전체적으로 빠져드려고 할때쯤 유치한 감성이 많이 아쉽게 다가왔다. 취향의 문제를 넘어서 만약 넘버라도 좀 하나 중독적인 구간이 있었으면 조금은 더 좋게 봤을텐데 뮤지컬 장르 영화임을 감안하면 기억에 남는 구간 보단 그냥 웡카가 일반적으로 보인 활약상만 기억에 겨우담아 그나마 볼만했던 영화로 간직할듯한 세상 누구보다 달콤하긴 했던 그런 영화였다.
리뷰 전문 보기 초콜릿이라는 마법 속으로 / 나에게도 아직 동심이 남아있음을 깨닫게 해준다 마법이 한 스푼 빠져 있는 세계
<웡카>는 친숙한 이야기와 기분 좋은 느낌으로 가득한 가벼운 오락 영화이며, 어린이 관객들을 더 즐겁게 해줄 가족 영화이다. 가장 큰 장점은 시각적인 향연으로, 생동감 넘치는 세트와 의상들, 다채롭고 화려한 색감들이 환상의 세계를 구현해낸다. 하지만 <웡카>는 음악 영역으로 넘어가면서 매력이 반감된다. 뮤지컬 영화로서 평범한 멜로디와 무난한 가사들은 관객을 기대감으로 들뜨게 만들지 못한다. 뭔가 마법이 한 스푼 빠져 있는 느낌이다. 영화를 다 보고 나서도 '초콜렛 천국'(1971)에서 가져온 움파룸파 송 말고는 기억에 남는 노래가 없어서 뒷맛이 아쉽다.

<웡카>는 호기심을 놀라움으로 발전시키지는 못하지만, 편안하면서 적당히 맛있는 온 가족이 함께 봐도 좋은 영화이다. 티모시 샬라메 버전의 교훈적인 동화(?).
2005년 조니뎁 주연의 <찰리와 초컬릿공장>이란 영화는 그저 재미와 주인공의 유머스러운 연기로 흥행성만 보는 오락영화는 아니었습니다.물론SF(특수효과)와 어린이 배우(프레디 하이모어등)들의 착하고,귀엽고,당돌하기까지한 연기가 볼만 했지만 이 영화가 담고있는 메세지는 어린이•어른들의 욕심,질투,허황된 꿈,지나친 기대를 하지말고 착하고 솔직하게 괜한 욕심없이 살면 진실한 행복이 찾아 온다는 것.이것을 얘기하려 함이었다고 생각했습니다.마냥 재미로만 보는 그런 SF 어린이용 영화는 아니었다고 생각합니다.
그런데 이번에 공개된 <웡카>는 제목의 인물을 연기했던 조니뎁 역할을 티모시샬라매가 하게 되었다고 했을때 사실 별로 기대하지 않았습니다.
팀버튼 감독님의 흥행성,작품성이 강했던 영화들의 단골인 마치 팀버튼 감독님의 페르소나인듯한 조니뎁의 웡카가 더욱 좋은 교훈을 준 훌륭한 연기였다고 생각했습니다.과연 영화<웡카>에서 티모시 배우가 조니뎁 배우의 연기를 뛰어넘는 모습을 보여줄까요?예고편만 봐서는 컴퓨터 그래픽으로 호화찬란하게 완성된 영화갔던데...
한마디로 티모시 샬라메 배우의 <웡카>도 볼 만한 영화 이기는 한것 같습니다. 너무 심심해져버린 스토리와 음악, 유치하게 느껴지기까지한 전개 달콤한 초콜릿 세계에 풍덩 빠진 2시간 경찰과 종교가 비호하는 거대 기업 카르텔과 꿈 많고 재능 있으며, 함께하는 동료도 있는 청년 사업가의 대결이 유쾌하게 펼쳐진다. 충치와 충분히 맞바꿀 눈과귀로 맛보는 달큰함 초콜릿으로 달콤한 꿈을 이뤄줄게
영화 <웡카>는 2005년에 개봉한 <찰리와 초콜릿 공장>에 등장한 윌리 웡카의 젊은 시절 이야기를 다루고 있었다. 티모시 샬라메가 웡카를 연기한다고 했을 때부터 기대했는데 영미권에서는 12월에 개봉한 데 반해 우리나라에서는 1월 말에 개봉했다. 영화를 보는 동안 왠지 모르게 크리스마스 느낌이 가득 풍기던 걸 보면 개봉 시기가 참 아쉽기만 하다.

영화 내용 자체는 특별할 게 없었다. 전체 관람가 영화라 아이들도 무난하게 즐길 수 있는 내용을 담고 있었고, 권선징악 역시 아이들의 눈높이에 맞춰 귀엽게 표현되었다. 그럴 거라 예상하고 본 영화이기에 엄청 좋지도 않았고 엄청 나쁘지도 않았다. 한 마디로 무난하게 볼 수 있는 가족 영화였다.
리뷰 전문 보기 큰 내용은 없지만 보면서 웃게 되는 초콜릿처럼 달콤한 영화. 보면 기분 좋아지는 동화같은 영화 뮤지컬 영화라는 점에서는 많이 부족하지만, 기분좋은 동화 조니 뎁의 웡카가 생각나지 않는 엉뚱 사랑미가 있는 티모시 웡카!! 현실의 쓰디씀, 꿈의 달콤함, 눈물의 짭쪼롬함을 모두 녹여낸 초코렛맛의 영화 중요한 건 함께 나누는 마음, 그리고 티모시의 미모🍫 나눔의 기쁨은 초콜릿 메이커도 춤추게 한다. 방향성을 상실한 이색적이고 호기심을 자아냈던 그 세계. 🍫 가족 뮤지컬로 돌아온 웡카, 실제 공연으로 나와도 좋을 듯 티모시 팬의 입장에서 만족스러웠다. 화려한 비주얼이 압도적이였고, 촬영감독의 역량이 여실히 발휘되었다. 이야기도 계속 전환되면서 관객을 잘 이끌어간다. 다소 심심한 음악이 아쉬웠다 웡카 용아맥 간단 후기 이런 뮤지컬 같은 영화인 줄 모르고 봤는데 덕분에 재미나게 봤다. 사람들마다 노래가 별로라고 하는 사람들도 있던데 내 귀에는 나쁘지 않았다. 뻔한 권선징악 ㅅ토리지만 그래서 좋았다 현대의 기술과 고전의 향취가 배합된 웡카의 초콜릿 보고 나면 엄마가 사무치게 그리워진다. 뻔하지만 달콤하게 어릴 때 만난 웡카이기에 반갑지만 그것 뿐이라 아쉽다. 찰리와 초콜릿공장이 그림형제의 잔혹동화였다면 웡카는 안데르센의 동화적인 면이 더 크다. 끝을 알 수 없는 그의 한계. 또다른 연기를 보여줬다. 영화도 남녀노소 스트레스 받지 않고 편하게 볼 수 있어 좋았다 달콤한 맛으로 가득하지만 아이들은 그것만으로 만족하니까 노스탤지어에 뿌리를 둔 희망찬 꿈의 메시지, 혹은 감상에 젖은 허무한 낙관주의. 그러나 후자마저도 사랑스러운 이야기. 초콜릿처럼 달달하고 행복해지는 기분을 전파한다."
노량: 죽음의 바다, 장엄한 북소리. 감히 어떤 말로도 표현할 수 없을 만큼 가슴이 벅차올랐다.
시민덕희," 실화를 모티브로 하였지만 실화는 아닌 이야기. 실화를 그대로 다뤘다면 오히려 욕먹었을 이야기를 적절하게 영화화하였다. 무엇보다 K-아줌마와 같은 끔찍한 혼종은 없어서 좋았다. 생각보다 더 코믹해서 재밌었고, 통쾌한 추격극이었다!! 딱 필요한 만큼만 담아 만든 스피디한 전개가 일품인 웰메이드 영화 치고 빠지는 방법을 막 배웠지만 예측 하기 쉬운 주먹은 여전. 너무 예상했던 대로 그대로를 보여주기에 아쉽다. 배우들의 빛나는 연기력이 없었다면 다소 유치했을뻔. <보이스>가 형사의 입장이었다면 <시민덕희>는 피해자의 마음을 담았다. 실화에 한국식 코메디와 장르 과정성을 끼얹다 뻔하지만 겁나 재밌다! (뻔해서 더 좋아. 실화니까.. 같은 해에 500만원 보이스피싱당했던 나... 나는 돈 못 찾았지만 겁나 속시원하네) 실화를 바탕으로 한 만큼, 어쩌면 서민이 할 수 있는 한도 내에서만 움직인 점이 <보이스>와의 차별화가 될듯 믿고 보는 배우들의 장르 불문 활약 기다려집니다 🙌🙌 무거운 주제를 유쾌하게 풀어내는 밸런스도 너무 좋고, 배우분들 연기 엄청나고 케미 또한 굳👍 웃음 포인트도 확실하고 재밌다 우린 쉽게 가볍게 갈래요 라미란 배우는 걸캅스를 찍기 전에 이런 영화를 기대하며 촬영하지 않았을까. 배우들의 연기와 각본이 빛난다 표값이 아깝지는 않은 영화 생각보다 흥미진진하고, 완전히 몰입하게 만드는 라미란 배우의 연기가 돋보인다. 농담할 시간도 있는 덕희 범죄 소재 영화라서 유머를 넣기 어려운 걸 감안해도 꽤 웃음의 쨉이 잘 들어간다.
범죄 소재 영화라서 유머를 넣기 어려운 걸 감안해도 꽤 웃음의 쨉이 잘 들어간다. 여기에 <시민 덕희>의 핵심인 우리가 느끼는 울분. 그러니까 경찰에 대한 울분, 사기꾼에 대한 울분, 사기 당한 사람이 욕먹은 이 지저분한 세상에 대한 통쾌한 스트레이트를 시원하게 날려주었다. 웃음과 울음, 답답함과 시원함이 공존 중요한 것만 감춘다. 보이스피싱, 연출. 실화 못지않게 울림과 희망을 차곡차곡 쌓아가는 추적극 실제 인물 덕희님께 무한 리스펙을 날립니다👍👍 가벼운 맘으로 갔다가 꿀잼이라 깜놀!? 실화 바탕 영화는 자칫 잘못하면 다큐 같아서 흥미가 떨어질 때도 있는가 하면, 사실성의 힘을 초석으로 흥미가 배가 되기도 한다. 이건 후자! 실화의 힘을 조금만 더 믿었더라면
한끝 부족한 선택과 집중

실화 기반 창작물은 언제나 같은 고민을 한다. 실화 중 어느 부분에 집중할지 신중히 결정해야 한다. 실화의 모든 인물, 사건, 갈등을 다루기에는 시간 압박이 있으므로. 범죄 사건의 경우 피해자, 가해자, 조력자, 목격자, 경찰 등 중에서 누구에게 포커스를 맞추느냐에 따라 전혀 다른 작품이 되기도 한다. 유영철 연쇄 살인 사건을 다룬 <추격자>와 <악의 마음을 읽는 자들>처럼.

<선희와 슬기>를 연출한 박영주 감독의 상업영화 데뷔작 <시민덕희>에서도 고민의 흔적을 찾을 수 있다. <시민덕희>는 2016년에 보이스피싱 조직 총책을 직접 잡은 세탁소 주인 김성자 씨의 사연을 다뤘다. 이 사건도 각색하기가 쉽지 않다. 경찰도 손을 뗀 사건을 직접 수사한 시민, 시민의 공로를 가로챈 무능한 경찰, 양심적인 선택을 한 보이스피싱 조직원, 결국 붙잡힌 총책 등 독특한 서사를 지닌 인물이 많기 때문이다.

<시민덕희>는 사건을 두 줄기로 나눴다. 우선 덕희와 재민이 정보를 캐내려 협력하는 서사가 중심이다. 그 덕분에 범죄 영화나 스릴러 분위기가 강하게 느껴진다. 주변부는 코미디로 꾸몄다. 덕희와 재민을 제외한 나머지 인물과 사건은 분위기 전환을 위한 웃음거리가 됐다. 일장일단이다. 전자가 생동감 넘치고 독특한 범죄 영화를 탄생시킨 원동력인 반면, 후자는 그 성과를 발목 잡는 원인이 됐다.


(...)


Poor 형편없음
어긋난 기대, 의외의 발견
리뷰 전문 보기 .
추진력과 행동력이 넘치는 덕희, 중국어와 한국어를 잘 하고 임기응변에 능한 봉림, 아이돌 팬이라 엄청난 대포 카메라를 가지고 있는 숙자, 택시 기사라 모두의 발과 숙소가 되어주는 예림까지 각각의 캐릭터들이 능력을 가지고 있는 것도 좋았고 이 좋은 캐릭터들을 연기하는 배우들의 연기도 찰떡같았다.

연출적인 면에서는 안일하고 식상하면서 쓸데없이 폭력적이라 좀 실망스러웠지만 그래도 배우들의 연기가 빛났고 이게 실화를 바탕으로 했다는 사실이 정말 놀라워서 실화의 주인공인 김성자님께 박수를 보낸다.

24.01.24 메가박스 부산대 절박해진 사람이 경쾌함을 찾기까지 억울함 앞에 더이상 시민은 기다리고만 있지 않는다. 돈만이 가져다주는 삶의 애환을 희화화하지 않으려 부단히 노력했다.
시도때도 없이 상황파악못하고 유머만 넣으면 어쩌나 했지만 시작부터 생각보다 수위가 있고 가볍지 않았다. 그렇다고 유머가 아예 없지도 않고 적재적소에 맞게 공감할만한 짠내유머들과 라미란을 대표로 애쓴 게 보였다. 피해자가 아닌 '시민'으로서 대응할만한 장르적 전개도 나쁘지않았다.

장윤주 역할만 살짝 덜었으면 좋았겠지만 후반에서 살짝 흐린눈하면 된다. 은희, 윤희에 이어 덕희까지 ‘희'자 돌림 여성캐릭터들은 정말 멋진 캐릭터인 듯하다. [시민덕희] 짧은 관람 후기
메가박스 이수에서 선희와 슬기를 연출했던 박영주 감독님의 첫 장편상업영화 코믹 수사극 '시민덕희'를 관람하고 왔습니다.
실제로 발생했던 보이스 피싱 사건을 모티브로 만들어진 작품이다보니 이야기 구조자체가 굉장히 탄탄하고 몰입감이 넘치는데다 장르적 재미도 적절하게 잘 챙겨서 근래 라미란 배우 주연의 코미디 베이스 작품들 중에서는 가장 탄탄하면서도 재미있는 작품이었던거 같습니다.

코로나 기간과 겹치면서 개봉이 밀려 크랭크업 이후 햇수로 거의 4년만에 개봉하는 작품이지만 다른 묵은(?!) 작품들과는 달리 입소문만 잘탄다면 충분히 흥행할 수 있는 좋은 작품이고 무엇보다도 평범한 소시민이 주인공인 작품이라 더욱 응원하고 싶어지는 그런 영화였던거 같습니다. 각색이 많아 영화로 볼 수 있는 이야기지만, 이것을 계기로 실화가 더 많이 알려질 수 있다면 성공 아닐까? 분량은 적지만 임팩트가 확실한 이무생도 색다르게 봤다."
찰리와 초콜릿 공장,
