titles,reviews
지푸라기라도 잡고 싶은 짐승들," 불친절의 재미
원작인 소네 케이스케의 지푸라기라도 잡고 싶은 짐승들을 읽어보진 못했지만 상당히 잘 각색하고 연출해내서 마음에 드는 영화였습니다.

아수라가 생각나는 정우성부터 언니다운 언니 전도연 등 모든 배우가 좋았고 김용훈 감독의 입봉작인데도 불구하고 많은 배우들을 착실하게 캐릭터를 쌓아올린게 대단했네요. 제목이 상당히 쎄기 때문에 우려가 좀~ 있었지만 생각보다 깔끔하게 찍어내서 내용과도 잘 어울렸습니다.

일행의 경우엔 제목때문에 망설였는데 관람하고 보니 정말 정붙일데가 없는 캐릭터들의 이야기라 호불호가 갈린다고 하더군요. 저로서는 그래서 더욱더 마음에 들었습니다.

제일 좋았던건 불친절함인데 시간, 장소에 대해 잘 알려주지 않고 빠르게 진행하다보니 보통 범죄 스릴러의 경우, 친절하거나 느려서 하지 않아도 먼저 머리속에서 예측이 되어버리는게 많은데 이번엔 경우의 수가 많고 불친절한 정보들로 인해 실시간적으로 조합되거나 조합되기 전까지 붙들고 있어야 하다보니 예측되긴해도 되도록이면 후반으로 미뤄지는게 상당히 마음에 들었습니다.

중요한 복선의 경우도 다시 한번 우회적으로 보여주지만 보통이라면 직접적으로 보여줄만한 것이었다보니 더 괜찮았는데 이제는 관객을 믿고 어느정도의 불편함을 감수하려는 시도로 보여 아주 좋았습니다.

범죄 스릴러 특유의 설명씬도 되도록이면 줄인게 눈에 보일 정도였고 극한직업과 마찬가지로 새롭다면 새롭게 관객에게 다시 한번 도전하는 깔끔하게 만들어진 청불 영화로서 아무래도 관객수는 쉽지 않겠지만 성과가 기대되는 영화네요. 또한 감독의 차기작도 기대됩니다.
리뷰 전문 보기 전도연이 연기하는 연희라는 인물은 동기가 딱히 없다. 동기가 없는데 그게 또 말이 되고 설득된다. 따로놀던 이야기조각을 한 데 모아주는 것도 단연 전도연이라는 배우. 플롯장난으로 전통적인 서사를 흥미롭게 보여주며 그야말로 돈가방으로 손을 뻗는 짐승들이 서로를 물어뜯는 과정을 거침없이 나열한다. 사람목숨을 파리목숨으로 여기는 것도 영화의 색깔이라면 색깔이니, 오히려 장르적인 노선을 확실히 했다는 생각이 든다. 궁극적으로는 아수라장을 딛고 솓아날 구멍도 있다는 메세지까지 전하는 야심찬 작품. 잡아봤자 지푸라기
배우들 때문에 기대를 하고 있었다. 거기다 해외 영화제와 시사회에서 많은 호평이 들렸고 더 큰 기대를 하게 되었다. 그래서인지 만족 보단 실망이 더 크다.

타란티노나 가이 리치의 범죄 영화가 떠오른다. 아마도 비선형적인 구조와 챕터식 구성 때문인 것 같다. 이런 구조에서 군상극을 그리는 건 쉽지 않은 작업일 것이다. 하지만 감독은 신인답지 않게 캐릭터와 이야기들의 균형을 잘 잡았고 지루하지 않게 극을 이끌었다. 하지만 챕터식 구성은 크게 와닿지 않았다. 이런 구성을 별로 안 좋아하는 취향이기도 하지만, 내내 ‘굳이?’라는 생각이 떠나지 않았다.
박평식 평론가는 ‘절박감을 떨어뜨리는 비선형 구조’라는 한줄평을 남겼다. 이 평에 몹시 공감이 간다. 이야기 자체는 매력적인 구석이 있다. 그리고 비선형 구조가 원작의 구성을 따온 것일지도 모른다. 하지만 구성과 전개는 산만했고 영화의 매력을 살리지 못 한 것 같다.

영화의 큰 장점은 배우들이다. 특히 전도연 배우는 극 중반 이후에야 등장하는데도 엄청난 카리스마를 보여준다. 그가 연기한 캐릭터는 명확한 동기도, 설득력도 없다. 하지만 가장 강렬한 인상을 남겼고 영화에서 보여주는 존재감은 확실하다. 다른 배우들도 뒤지지 않는 연기력으로 멋진 퍼포먼스를 보여준다.

한가지 아쉬운 점은 이런 퍼포먼스들이 굉장히 익숙하다는 것이다. 당연히 모두 빼어난 연기지만 이미 본 듯한, 충분히 예상 가능한 이미지와 캐릭터였다.
후반부의 전개도 예상에서 크게 벗어나지 않았다. 사실 이 영화의 소재는 많이 다뤄진 것이다. 하지만 같은 이야기라도 어떻게 연출하느냐에 따라 다른 영화가 될 수 있다. 그런 점에서 <지푸라기라도 잡고 싶은 짐승들>은 많이 아쉽다.

이 영화에 관심이 생긴 또 다른 이유는 감독의 특이한 이력이다. 영화를 연출하기 위해 큰 용기를 냈을 것이다. 그리고 첫 연출한 장편은 큰 호평을 얻었고 상까지 받았다. 감독 커리어의 출발로 상당히 좋은 시작이다. 비록 이 영화는 실망스러웠지만 감독만의 독창적인 비전으로 그릴 다음 영화가 기대된다. 이 영화를 보고나서 든 첫 느낌은 신인감독같지않은 리듬감이었습니다.

유려한 편집으로 만들어진 쫄깃함과 스무스함이 전체적으로 매끈한 리듬을 만든 것에 감독의 이름을 찾아보게 하더군요.

첫장면에서 시선을 확 끌지 않아도 엔딩까지 부드럽고 빠르게 진행되는 건 이 영화의 가장 큰 장점입니다.



그리고 이 영화의 정우성배우 너무 맘에 드네요.
액션연기와 내달리는 감정의 포효는 좋았지만 뭔가 아쉬었던 정우성 배우였는데 이 영화에서는 전혀 다른 느낌이라서 정말 좋았습니다.

스펙트럼이 넓어진 배우의 연기는 참 보는 맛이 있습니다.
전도연 배우, 윤제문 배우와 앙상블 연기할 때도 자기 캐릭터를 확실히 하면서 부드럽게 잘 빠져나가는 느낌이 좋더군요.
이런 캐릭터에 너무 잘 맞아서 색달랐습니다.

원작을 읽어 보진 않았지만 전체적으로 인물들이 얽힌 관계거 조여졌다 풀리는 느낌들이 맘에듭니다. 당연히 예상되는 흐름인데도 가끔 패턴을 바꾸는 작은 방점들이 모이니 전체적으로 준수한 군상극이면서 재밌는 범죄느와르물이었습니다.


저한테 1월의 한국영화가 남산이었다면 2월은 이 영화네요. 잘 빠진 범죄 스릴러. 영화를 보면서는 연출력도 안정적이고 재미있게 봤는데 보고 나니까 여운이 없다. 배우들의 연기도 크게 인상적이지 않았다. 전도연이 이 정도 연기를 하는 건 당연하니까. 비선형 플롯 구조도 쿠엔틴 타란티노의 <저수지의 개들>, <펄프 픽션>이 이미 나온 마당에 많이 신선하지는 않았다. 잘 만들었는데 뭔가 아쉬운 이 기분은 도대체 뭘까. 아무나 제발 한 놈이라도 지푸라기 잡고 나오라고 100분동안 기도하게 만드는 영화 캐릭터와 이야기가 깔끔하고 편집 스타일도 꽤 매력적이다 내용도 내용인데 제목이 가히 완벽하다. . 살아남는 자가 강하다는 세상의 법칙 아래에서 치고받는 상어들의 지독한 먹이사슬. 절박함으로 만드는 과감함 하지만 지나치는 과감함 킬링타임용👐 '우연히 돈가방이 내 앞에 있었다' 우연에 모든 것을 맡기는 전개, 코미디로는 나쁘지 않아 제목이 너무 어렵다. 지푸라기와 짐승은 뭔가 어색하네. 어디서 많이 본 신선한 영화. 코로나 억까가 제일 아쉽다 한국영화계에 가능성을 비춰주는 시도. 하필 코로나19로 타이밍을 잘못 탔지만 영화에서 보여주듯 타이밍이 많은 것을 바꾸기도 한다. 평이한 스토리를 역순으로 재구성하고 배우들의 카리스마로 덮으려 했으나 평이함이 가려지지 않는다. 다시 돌고~ 돌고... 플롯이 다했다! 전도연의 매력이 폭팔하는 오랜만에 흥미로웠던 한국영화 연출에 있어 시도를 많이 한 노력이 보인 작품. .
#1. 피로 찍어낸 돈은 늘 냄새를 풍긴다
이 작품에서의 최대의 화두는 단연 돈가방이 아닐 수 없다. 주요 등장인물 모두와 직접적으로 연관이 되는 이 돈가방의 이동을 보고 있자니 <무한도전>의 추격전이 떠올랐다. 물론 도덕성 측면에서는 비교 자체가 불가하지만 말이다.
애초에 피를 잉크로 하여 찍어내고, 증오와 원망을 재료삼아 만들어낸 돈이었다. 한낱 종이에 불과할지라도 그에 배인 냄새는 어디가지 않는다. 어떻게든 이 돈가방을 기막히게 찾아내는 사람들을 보아라. 그 욕망의 냄새에 사로잡힌 자들의 감각은 놀랄만큼 예민하면서도 잔혹하기 이를데 없었다.

#2. 비선형의 무브과 맥락
전개가 선형적이지 않은 작품이다. 하나의 줄기가 아니라 여러 줄기가 얽히고 꼬여 종국에 이르러 맥락이 완성되는 구조이다. 이를 대변이라도 하듯 등장인물들의 행동에도 처음엔 맥락과 원리가 떨어지는 경향이 있다. 극을 다 보고나면 왜 그랬을까 어느 정도 생각은 해볼 수 있겠다만 그 전에는 의아한 점이 많은 그러한 전개였다. 다소 작위적이었으나, 그 의도는 이해하기에 그려려니 하고 보았다. 물론 판단은 관객들의 자유이다.

#3. 살아만 있다면 길은 늘 있다
뜬금없이 행운을 잡았으나 그 행운으로 하여금 모든 것을 잃고 파국으로 치닫게 되었다. 그런 아들을 향해 치매기가 있는 어머니는 위로같지 않은 위로를 건넨다. 별 뜻 없이 그저 절망을 극대화하는 장치겠거니 싶었다. 그 끝은 본 사람이라면 이 말의 의미를 다들 알 것인데, 위에서 말한 것처럼 작위적일지라도, 결국엔 그나마 순수한 욕망과 방법에 대한 면죄부가 쥐여지게 되었다. (그렇다고 무죄는 아니겠지만..) 뿌린 대로 거두는 것이고, 그 거둠은 아직 완수되지 않은 것일수 있기에 다소 성급한 판단이지만 말이다. 죽기 전까지 끝난건 아니라는 것, 그거 하나만은 확실한 영화였다 할 수 있을 것이다. 21 08 04 이 많은 인물이 도대체 어떻게 엮일까 궁금했는데 틈 없이 스토리가 이어지고, 가방의 행적을 쫓는 게 꽤 재미있다. 힘은 부족하지만 물을 흐르듯이 매끄러워서 좋다. [2021. 5. 9 일요일] 퍼즐이 맞추어지는 과정을 보는 재미. 2020-04-15 / <전도연>의 필모그래피를 위한 영화 김용훈 감독, '크게 될' 냄새가 난다. (+ 전도연은 정말로 한국 영화계의 소중한 보물이다.) 연기 앙상블 좋고 이야기가 끝까지 잘 맞물려서 좋고 근데 영화 분위기상 폭력과 섹스가 더 세게 나와야되지 않나 하는 개인적인 약간의 아쉬움.. 시작은 세가지 이야기임에도 복잡하지 않고, 뛰어난 연기와 군더더기 없는 연출이 만났다."
